{"action_id":"patch-001","created_at":"2026-10-12T00:00:00Z","experiment_id":"EXP-PROC-7X9D-01","field_reviews":{"artifact_source":{"edit_reason":"Accept as written: index-derived artifact path for the deb8u16 revision; S011 bytes match S010 stanza SHA-256 and size exactly; no new artifact constructed.","evidence_refs":["S010","S011"],"final_value":"http://archive.debian.org/debian-security/pool/updates/main/a/apache2/apache2_2.4.10-10+deb8u16_amd64.deb","missing_evidence_detected":false,"original_value":"http://archive.debian.org/debian-security/pool/updates/main/a/apache2/apache2_2.4.10-10+deb8u16_amd64.deb","review_class":"NO_EDIT","unsupported_claim_detected":false},"build_system":{"edit_reason":"Accept as written: FixType C is not a source build; under Kalama semantics build_system applies only to FixType A, so null with NOT_APPLICABLE is correct.","evidence_refs":[],"final_value":null,"missing_evidence_detected":false,"original_value":null,"review_class":"NO_EDIT","unsupported_claim_detected":false},"command":{"edit_reason":"Accept as written: command gate is SUPPORTED. apt-get update precedes install with exact-version pins covering apache2 and version-pinned siblings from the S010 closure; unversioned base deps excluded per closure convention; apache2ctl configtest precedes graceful with && failure propagation per S016/S017; graceful semantics per S016; apt semantics per S018; no unrelated mutation; repo/interface preconditions are explicitly labeled assumptions, not asserted facts.","evidence_refs":["S010","S015","S016","S017","S018"],"final_value":"apt-get update && apt-get install -y apache2=2.4.10-10+deb8u16 apache2-bin=2.4.10-10+deb8u16 apache2-data=2.4.10-10+deb8u16 apache2-utils=2.4.10-10+deb8u16 && apache2ctl configtest && apache2ctl graceful","missing_evidence_detected":false,"original_value":"apt-get update && apt-get install -y apache2=2.4.10-10+deb8u16 apache2-bin=2.4.10-10+deb8u16 apache2-data=2.4.10-10+deb8u16 apache2-utils=2.4.10-10+deb8u16 && apache2ctl configtest && apache2ctl graceful","review_class":"NO_EDIT","unsupported_claim_detected":false},"fix_type":{"edit_reason":"Accept as written: debian deb OS package carried in distro archive indexes; FixType C OS-package selection matches Kalama contract routing and package-manager mapping.","evidence_refs":["SEED-01","S009","S010"],"final_value":"C","missing_evidence_detected":false,"original_value":"C","review_class":"NO_EDIT","unsupported_claim_detected":false},"notes":{"edit_reason":"Accept as written: advisory lineage, deb8u15 supersession/deficiency per DLA-1900-2 and bug 941202, deb8u16 as regression-corrected revision, lineage preservation with no major-version move, KEV checked-negative, patch-001 scope bounds and bounded assurance; no success or exploit-blocked claim.","evidence_refs":["S001","S006","S007","S008","S010","S012","S013","S014","S021"],"final_value":"DLA-1900-1 addresses CVE-2019-10092 and incidental CVE-2019-10098 on jessie. Scanner-fixed deb8u15 is superseded (no stanza in the live jessie-security index; existence corroborated by snapshot) and deficient per DLA-1900-2 and Debian bug 941202 (incomplete fix for the primary CVE plus balancer-manager regression); deb8u16 reverts the change and carries the correct upstream patch, so it is the selected fix revision. The target preserves the jessie backport lineage and amd64 revision chronology from installed deb8u12 to deb8u16, with no major-version move to upstream 2.4.41 or to the stretch revision. KEV is checked-negative for both CVEs. The source-built bash PATH prefix and live mod_proxy and mod_rewrite state are out of scope for patch-001 with no live execution; post-change assurance is bounded to version, config-syntax, and service-state checks.","missing_evidence_detected":false,"original_value":"DLA-1900-1 addresses CVE-2019-10092 and incidental CVE-2019-10098 on jessie. Scanner-fixed deb8u15 is superseded (no stanza in the live jessie-security index; existence corroborated by snapshot) and deficient per DLA-1900-2 and Debian bug 941202 (incomplete fix for the primary CVE plus balancer-manager regression); deb8u16 reverts the change and carries the correct upstream patch, so it is the selected fix revision. The target preserves the jessie backport lineage and amd64 revision chronology from installed deb8u12 to deb8u16, with no major-version move to upstream 2.4.41 or to the stretch revision. KEV is checked-negative for both CVEs. The source-built bash PATH prefix and live mod_proxy and mod_rewrite state are out of scope for patch-001 with no live execution; post-change assurance is bounded to version, config-syntax, and service-state checks.","review_class":"NO_EDIT","unsupported_claim_detected":false},"source_identifier":{"edit_reason":"Accept as written: Filename field of the live jessie-security apache2 stanza at the selected revision.","evidence_refs":["S010"],"final_value":"pool/updates/main/a/apache2/apache2_2.4.10-10+deb8u16_amd64.deb","missing_evidence_detected":false,"original_value":"pool/updates/main/a/apache2/apache2_2.4.10-10+deb8u16_amd64.deb","review_class":"NO_EDIT","unsupported_claim_detected":false},"strategy":{"edit_reason":"Accept as written: PACKAGE_MANAGER is the default pairing for FixType C; jessie backport upgrade at the regression-corrected revision with no major-version move.","evidence_refs":["S006","S010","S013"],"final_value":"PACKAGE_MANAGER","missing_evidence_detected":false,"original_value":"PACKAGE_MANAGER","review_class":"NO_EDIT","unsupported_claim_detected":false},"target_version":{"edit_reason":"Accept as written: live jessie-security stanza revision with DLA-1900-2 regression-corrected fix; correctly supersedes deficient scanner-fixed deb8u15 while preserving jessie lineage and revision chronology; does not use scanner FixedVersion blindly.","evidence_refs":["S008","S010","S013","S014","S021"],"final_value":"2.4.10-10+deb8u16","missing_evidence_detected":false,"original_value":"2.4.10-10+deb8u16","review_class":"NO_EDIT","unsupported_claim_detected":false},"validation_command":{"edit_reason":"Accept as written: validation gate is SUPPORTED. Debian control-interface config-syntax check; explicitly bounded to syntax only with no exploit-blocked or fixed claim; no unsupported version/service command added; no exploit verification required.","evidence_refs":["S016","S017"],"final_value":"apache2ctl configtest","missing_evidence_detected":false,"original_value":"apache2ctl configtest","review_class":"NO_EDIT","unsupported_claim_detected":false}},"pack_sha256":"403dce7897cd0d209f0f409c30fe5d272cc1d109eb0df1694dbf8b91c62caeae","proposal_sha256":"fa2de79e7fd1843222097c269f35541590a7bfc5bed6a225f5fcf414727a642d","reviewer_context":"ROLE_B_ARM_C isolated surrogate reviewer; read only the four authorized files (evidence_pack.json, agent_proposal.json, kalama_patch_semantics_v1.json, human_review.schema.json); no sibling arms/proposals/reviews, no phase reports, no source graph/manifests/logs, no authority decisions, no frozen seed/raw evidence, no git history; no web, no retrieval, no execution; proposal frozen, never modified; file SHA computed via shell.","run_id":"6WUM1","schema":"kalama.patch-assist-prototype/human-review/v1"}