{"action_id": "patch-001", "created_at": "2026-09-18T11:10:00Z", "experiment_id": "EXP-BASH-7X9B-01", "field_reviews": {"artifact_source": {"edit_reason": "artifact_provenance is deterministically INSUFFICIENT and missing_evidence ARTIFACT_SOURCE_UNRESOLVED lists no fixed .deb location, availability, or hashes. No retrieved artifact exists to cite; proposing any value would be invention.", "evidence_refs": [], "final_value": null, "missing_evidence_detected": true, "original_value": null, "review_class": "ABSTENTION_ACCEPTED", "unsupported_claim_detected": false}, "build_system": {"edit_reason": "No build metadata retrieved in this arm and dependency_closure is INSUFFICIENT; the production build-system vocabulary is maven-only and inapplicable to this deb candidate on present evidence. Abstention is the safe, correct state.", "evidence_refs": [], "final_value": null, "missing_evidence_detected": true, "original_value": null, "review_class": "ABSTENTION_ACCEPTED", "unsupported_claim_detected": false}, "command": {"edit_reason": "evidence_sufficiency.command is INSUFFICIENT (L5 missing, PROCEDURE_UNKNOWN). Gate requires null; reviewer must not supply command text.", "evidence_refs": [], "final_value": null, "missing_evidence_detected": true, "original_value": null, "review_class": "ABSTENTION_ACCEPTED", "unsupported_claim_detected": false}, "fix_type": {"edit_reason": "Production contract names FixType{A,B,C} but states no semantic mapping usable to select among them for this candidate, and the L1 pack supplies no fix-type-discriminating evidence. Human cannot determine the field from pack plus system semantics without new evidence.", "evidence_refs": [], "final_value": null, "missing_evidence_detected": true, "original_value": null, "review_class": "ABSTENTION_ACCEPTED", "unsupported_claim_detected": false}, "notes": {"edit_reason": "Notes stay within pack content: scanner-bound package/version/DLA id, out-of-scope adjacent source-built bash per runtime evidence note, DLA prose unavailability, and absence of artifact/procedure evidence. No remediation claim beyond the candidate, no command leakage, no claim on incidental CVE-2016-9401.", "evidence_refs": ["SEED-01", "S003", "S004"], "final_value": "Scanner-bound candidate is the debian OS package bash 4.3-11+deb8u1 with scanner FixedVersion 4.3-11+deb8u2 (DLA-1726-1). Adjacent source-built /usr/local/bash-4.3.0 is out of scope for patch-001. DLA announcement prose was unreachable in this arm, so the version rests on the scanner record plus the retrieved upstream fix entry. No fixed .deb location, hashes, or deployment procedure are present in this arm.", "missing_evidence_detected": false, "original_value": "Scanner-bound candidate is the debian OS package bash 4.3-11+deb8u1 with scanner FixedVersion 4.3-11+deb8u2 (DLA-1726-1). Adjacent source-built /usr/local/bash-4.3.0 is out of scope for patch-001. DLA announcement prose was unreachable in this arm, so the version rests on the scanner record plus the retrieved upstream fix entry. No fixed .deb location, hashes, or deployment procedure are present in this arm.", "review_class": "NO_EDIT", "unsupported_claim_detected": false}, "source_identifier": {"edit_reason": "artifact_provenance is INSUFFICIENT and no artifact identifier was retrieved in this arm; any identifier would be invented.", "evidence_refs": [], "final_value": null, "missing_evidence_detected": true, "original_value": null, "review_class": "ABSTENTION_ACCEPTED", "unsupported_claim_detected": false}, "strategy": {"edit_reason": "patch_strategy gate is PARTIAL with L3/L4/L5 missing and the pack states strategy is blocked without artifact provenance. Selecting among the 9 production strategies would require artifact/procedure evidence absent here; inferring a package-manager strategy from general OS knowledge is prohibited.", "evidence_refs": [], "final_value": null, "missing_evidence_detected": true, "original_value": null, "review_class": "ABSTENTION_ACCEPTED", "unsupported_claim_detected": false}, "target_version": {"edit_reason": "Value equals the scanner FixedVersion for the same debian bash package/distro context (SEED-01, HIGH, used_for target_version) with upstream fix-entry corroboration (S004, MEDIUM); deb8u backport lineage preserved and MEDIUM confidence correctly reflects unreachable DLA prose. No major-family change, no overclaim.", "evidence_refs": ["SEED-01", "S004"], "final_value": "4.3-11+deb8u2", "missing_evidence_detected": false, "original_value": "4.3-11+deb8u2", "review_class": "NO_EDIT", "unsupported_claim_detected": false}, "validation_command": {"edit_reason": "evidence_sufficiency.validation_command is INSUFFICIENT (L5 missing, PROCEDURE_UNKNOWN). Gate requires null; reviewer must not supply validation text.", "evidence_refs": [], "final_value": null, "missing_evidence_detected": true, "original_value": null, "review_class": "ABSTENTION_ACCEPTED", "unsupported_claim_detected": false}}, "pack_sha256": "c7d22143166595953bc28f757903945855eff1e040a18cfaa888d1f8f79e25f2", "proposal_sha256": "5eb61cd1bb2aa20c3712fdb622df86164cb832375d997d988a7ec95bcbb85dd2", "reviewer_context": "ROLE B surrogate; fresh review over frozen ARM_A_L1 pack and proposal only. Read no sibling arms, no phase/case/contamination files, no raw sources, no reference answers; no web or retrieval; modified neither pack nor proposal.", "run_id": "B9X4K", "schema": "kalama.patch-assist-prototype/human-review/v1"}