{"schema":"kalama.patch-assist-prototype/human-review/v1","experiment_id":"EXP-BASH-7X9C-SEM-01","run_id":"B9X4K","action_id":"patch-001","proposal_sha256":"3cd2cc3578d70c9b3770f1ca5a12780df9fc92e9a767a6bf4fadb75540a5c1e1","pack_sha256":"a780084f1983f6b2136a90617d359353df034546cd6f4c021e64ababcfc24707","reviewer_context":"Fresh-session surrogate reviewer; pack-only review with no new retrieval and no pack modification; contract used for meaning only.","field_reviews":{"fix_type":{"original_value":"C","final_value":"C","review_class":"NO_EDIT","edit_reason":"Accept C: contract selection rule for C routes on deb ecosystem with apt mapping, and pack shows deb PURL ecosystem plus jessie archive indices; no general-knowledge inference required and no claim exceeds pack.","evidence_refs":["SEED-01","S010","S011"],"unsupported_claim_detected":false,"missing_evidence_detected":false},"strategy":{"original_value":"PACKAGE_MANAGER","final_value":"PACKAGE_MANAGER","review_class":"NO_EDIT","edit_reason":"Accept: PACKAGE_MANAGER is the contract default pairing for C and is not in the contract invalid pairings for C; fixed stanza and DLA record support manager upgrade with no excess claim.","evidence_refs":["S011","S013"],"unsupported_claim_detected":false,"missing_evidence_detected":false},"target_version":{"original_value":"4.3-11+deb8u2","final_value":"4.3-11+deb8u2","review_class":"NO_EDIT","edit_reason":"Accept: jessie fixed revision corroborated by tracker, security index stanza, and DLA record; scanner fixed value consistent; no claim exceeds remediation evidence.","evidence_refs":["S007","S011","S013"],"unsupported_claim_detected":false,"missing_evidence_detected":false},"artifact_source":{"original_value":"http://archive.debian.org/debian-security/pool/updates/main/b/bash/bash_4.3-11+deb8u2_amd64.deb","final_value":"http://archive.debian.org/debian-security/pool/updates/main/b/bash/bash_4.3-11+deb8u2_amd64.deb","review_class":"NO_EDIT","edit_reason":"Accept: exact retrieved artifact identity derived from security index filename with byte match to index hash and size; no invented artifact and no excess claim.","evidence_refs":["S011","S012"],"unsupported_claim_detected":false,"missing_evidence_detected":false},"source_identifier":{"original_value":"pool/updates/main/b/bash/bash_4.3-11+deb8u2_amd64.deb","final_value":"pool/updates/main/b/bash/bash_4.3-11+deb8u2_amd64.deb","review_class":"NO_EDIT","edit_reason":"Accept: index filename matches retrieved artifact identity for the fixed revision; no claim exceeds remediation evidence.","evidence_refs":["S011","S012"],"unsupported_claim_detected":false,"missing_evidence_detected":false},"build_system":{"original_value":null,"final_value":null,"review_class":"NO_EDIT","edit_reason":"Accept null as NOT_APPLICABLE: contract limits build vocabulary to source-build FixType A; non-source-build carries no build system; no excess claim.","evidence_refs":[],"unsupported_claim_detected":false,"missing_evidence_detected":false},"command":{"original_value":null,"final_value":null,"review_class":"ABSTENTION_ACCEPTED","edit_reason":"Accept abstention: pack gate for command is INSUFFICIENT with L5 missing and procedure unknown, so null is required and no draft is permitted.","evidence_refs":[],"unsupported_claim_detected":false,"missing_evidence_detected":true},"validation_command":{"original_value":null,"final_value":null,"review_class":"ABSTENTION_ACCEPTED","edit_reason":"Accept abstention: pack gate for validation_command is INSUFFICIENT with L5 missing and procedure unknown, so null is required and no draft is permitted.","evidence_refs":[],"unsupported_claim_detected":false,"missing_evidence_detected":true},"notes":{"original_value":"DLA-1726-1 fixes CVE-2019-9924 in jessie as backport 4.3-11+deb8u2, distinct from unstable 4.4-1; upstream BASH_CMDS fix carried as backport. KEV checked-negative. Fixed-revision dependency closure complete with no unresolved entries.","final_value":"DLA-1726-1 fixes CVE-2019-9924 in jessie as backport 4.3-11+deb8u2, distinct from unstable 4.4-1; upstream BASH_CMDS fix carried as backport. KEV checked-negative. Fixed-revision dependency closure complete with no unresolved entries.","review_class":"NO_EDIT","edit_reason":"Accept: version-family distinction, upstream backport scope, checked-negative status, and complete dependency closure are each drawn from retrieved evidence with no excess claim and no new facts added.","evidence_refs":["S004","S008","S011","S013"],"unsupported_claim_detected":false,"missing_evidence_detected":false}},"created_at":"2026-09-18T11:00:00Z"}