{"action_id": "patch-001", "created_at": "2026-10-12T12:00:00Z", "experiment_id": "EXP-PROC-7X9D-01", "field_reviews": {"artifact_source": {"edit_reason": "S010 Filename derives pool path and S011 retrieved bytes match S010 size and SHA-256 exactly per checksum_match; URL directly constructible from this arm's evidence with no new sources.", "evidence_refs": ["S010", "S011"], "final_value": "http://archive.debian.org/debian-security/pool/updates/main/a/apache2/apache2_2.4.10-10+deb8u16_amd64.deb", "missing_evidence_detected": false, "original_value": "http://archive.debian.org/debian-security/pool/updates/main/a/apache2/apache2_2.4.10-10+deb8u16_amd64.deb", "review_class": "NO_EDIT", "unsupported_claim_detected": false}, "build_system": {"edit_reason": "Contract build_system_semantics reserves build_system for FixType A source builds (vocabulary maven only); this case is FixType C OS package, so null NOT_APPLICABLE is correct and no build value applies.", "evidence_refs": [], "final_value": null, "missing_evidence_detected": false, "original_value": null, "review_class": "NO_EDIT", "unsupported_claim_detected": false}, "command": {"edit_reason": "Pack evidence_sufficiency.command is INSUFFICIENT from PROCEDURE_UNKNOWN gap with L5 missing; correct abstention with null value. Gate is authoritative and no remediation instruction may be filled.", "evidence_refs": [], "final_value": null, "missing_evidence_detected": true, "original_value": null, "review_class": "ABSTENTION_ACCEPTED", "unsupported_claim_detected": false}, "fix_type": {"edit_reason": "Pack candidate_identity identifies apache2 debian OS package with deb ecosystem and S009/S010 deb indexes corroborate; contract selection_rule routes deb ecosystems to OS-package provider FixType C.", "evidence_refs": ["SEED-01", "S009", "S010"], "final_value": "C", "missing_evidence_detected": false, "original_value": "C", "review_class": "NO_EDIT", "unsupported_claim_detected": false}, "notes": {"edit_reason": "Each clause traces to this pack: live index later revision, scanner revision absent/superseded, snapshot contains all three, bytes match checksums, closure complete with pinned siblings, KEV checked-negative for both CVEs, release-significance gap recorded without asserting installability beyond index presence. No success, service, repo-config, exploit-blocking, or out-of-scope claims; patch-001 scope preserved.", "evidence_refs": ["S006", "S007", "S008", "S010", "S011"], "final_value": "Live security index provides later revision within same lineage; scanner-indicated revision absent from live index and superseded; snapshot list contains all three revisions; downloaded artifact bytes match index checksums; dependency closure complete with version-pinned siblings present; KEV feed checked-negative for both CVEs; release-significance gap recorded and installability not asserted beyond index presence.", "missing_evidence_detected": true, "original_value": "Live security index provides later revision within same lineage; scanner-indicated revision absent from live index and superseded; snapshot list contains all three revisions; downloaded artifact bytes match index checksums; dependency closure complete with version-pinned siblings present; KEV feed checked-negative for both CVEs; release-significance gap recorded and installability not asserted beyond index presence.", "review_class": "NO_EDIT", "unsupported_claim_detected": false}, "source_identifier": {"edit_reason": "Value equals the Filename field of the S010 live security index stanza and the S011 artifact path derivation; no new artifact identity introduced.", "evidence_refs": ["S010", "S011"], "final_value": "pool/updates/main/a/apache2/apache2_2.4.10-10+deb8u16_amd64.deb", "missing_evidence_detected": false, "original_value": "pool/updates/main/a/apache2/apache2_2.4.10-10+deb8u16_amd64.deb", "review_class": "NO_EDIT", "unsupported_claim_detected": false}, "strategy": {"edit_reason": "PACKAGE_MANAGER is the contract default pairing for FixType C and is not in the invalid-pairings list; pack patch_strategy is SUPPORTED with S005/S006 advisory and S010 index supporting the package-manager path.", "evidence_refs": ["S005", "S006", "S010"], "final_value": "PACKAGE_MANAGER", "missing_evidence_detected": false, "original_value": "PACKAGE_MANAGER", "review_class": "NO_EDIT", "unsupported_claim_detected": false}, "target_version": {"edit_reason": "Does not blindly use scanner FixedVersion deb8u15; selects live S010 stanza deb8u16 with matching S011 bytes, corroborated by S008 snapshot list containing installed, scanner-indicated, and selected revisions. Preserves package lineage and amd64 arch, acknowledges scanner revision absent/superseded in live index, and records RELEASE_RATIONALE_UNINTERPRETED gap without asserting release significance or installability beyond index presence.", "evidence_refs": ["S008", "S010", "S011"], "final_value": "2.4.10-10+deb8u16", "missing_evidence_detected": true, "original_value": "2.4.10-10+deb8u16", "review_class": "NO_EDIT", "unsupported_claim_detected": false}, "validation_command": {"edit_reason": "Pack evidence_sufficiency.validation_command is INSUFFICIENT; correct abstention with null value. Gate is authoritative and no verification instruction may be filled.", "evidence_refs": [], "final_value": null, "missing_evidence_detected": true, "original_value": null, "review_class": "ABSTENTION_ACCEPTED", "unsupported_claim_detected": false}}, "pack_sha256": "0c5e127b1eba7997a181de6035cdbb3cfa237752db4a29cfc4d4723ccbe55101", "proposal_sha256": "34c25b0b73ab9513ce132376056bc559325c08242080236211c5899906ad7593", "reviewer_context": "Isolated surrogate ROLE_B_ARM_A; read only evidence_pack.json, agent_proposal.json, kalama_patch_semantics_v1.json, human_review.schema.json; no sibling reads, no retrieval, no execution.", "run_id": "6WUM1", "schema": "kalama.patch-assist-prototype/human-review/v1"}