{"action_id": "patch-001", "created_at": "2026-10-12T00:00:00Z", "experiment_id": "EXP-PROC-7X9D-01", "field_reviews": {"artifact_source": {"edit_reason": "Index-derived pool URL for deb8u16; S010 stanza provides path and S011 retrieved bytes match S010 SHA-256 and size exactly. No new source.", "evidence_refs": ["S010", "S011"], "final_value": "http://archive.debian.org/debian-security/pool/updates/main/a/apache2/apache2_2.4.10-10+deb8u16_amd64.deb", "missing_evidence_detected": false, "original_value": "http://archive.debian.org/debian-security/pool/updates/main/a/apache2/apache2_2.4.10-10+deb8u16_amd64.deb", "review_class": "NO_EDIT", "unsupported_claim_detected": false}, "build_system": {"edit_reason": "Contract limits build_system to FixType A source builds (maven only); FixType C carries null as NOT_APPLICABLE. No evidence required.", "evidence_refs": [], "final_value": null, "missing_evidence_detected": false, "original_value": null, "review_class": "NO_EDIT", "unsupported_claim_detected": false}, "command": {"edit_reason": "Pack evidence_sufficiency.command is INSUFFICIENT with PROCEDURE_UNKNOWN L5 missing; gate is authoritative so command must remain null. Agent abstention with COMMAND_GATE_INSUFFICIENT is correct; no value filled.", "evidence_refs": [], "final_value": null, "missing_evidence_detected": true, "original_value": null, "review_class": "ABSTENTION_ACCEPTED", "unsupported_claim_detected": false}, "fix_type": {"edit_reason": "Candidate is debian OS package with deb ecosystem per pack identity; contract routes os-pkgs/deb to OS-package provider mapping to FixType C. Supported by SEED-01 identity and S009/S010 registry metadata.", "evidence_refs": ["SEED-01", "S009", "S010"], "final_value": "C", "missing_evidence_detected": false, "original_value": "C", "review_class": "NO_EDIT", "unsupported_claim_detected": false}, "notes": {"edit_reason": "Lineage, supersession, KEV checked-negative, closure, and out-of-scope statements each trace to this pack (S006/S010/S013/S014/S007 and dependency closure S010); correctly notes deb8u15 deficient per DLA-1900-2 without broadening scope to incidental CVE or source-built shell.", "evidence_refs": ["S006", "S010", "S013", "S014", "S007"], "final_value": "Jessie backport line retained without major-version move. Scanner-reported deb8u15 is superseded and deficient per the DLA-1900-2 regression record; deb8u16 carries the corrected upstream patch. KEV checked-negative for the primary CVE. Dependency closure verified in the security index; incidental open-redirect CVE shares the DLA but is out of scope for patch-001.", "missing_evidence_detected": false, "original_value": "Jessie backport line retained without major-version move. Scanner-reported deb8u15 is superseded and deficient per the DLA-1900-2 regression record; deb8u16 carries the corrected upstream patch. KEV checked-negative for the primary CVE. Dependency closure verified in the security index; incidental open-redirect CVE shares the DLA but is out of scope for patch-001.", "review_class": "NO_EDIT", "unsupported_claim_detected": false}, "source_identifier": {"edit_reason": "Filename field of S010 security-index stanza for deb8u16 preserves distro lineage and arch; matches artifact_evidence filename.", "evidence_refs": ["S010"], "final_value": "pool/updates/main/a/apache2/apache2_2.4.10-10+deb8u16_amd64.deb", "missing_evidence_detected": false, "original_value": "pool/updates/main/a/apache2/apache2_2.4.10-10+deb8u16_amd64.deb", "review_class": "NO_EDIT", "unsupported_claim_detected": false}, "strategy": {"edit_reason": "PACKAGE_MANAGER is contract default pairing for FixType C; advisory lineage S006/S012/S013 supports package-manager remediation within jessie backport line and patch_strategy gate is SUPPORTED.", "evidence_refs": ["S006", "S012", "S013"], "final_value": "PACKAGE_MANAGER", "missing_evidence_detected": false, "original_value": "PACKAGE_MANAGER", "review_class": "NO_EDIT", "unsupported_claim_detected": false}, "target_version": {"edit_reason": "Does not use scanner FixedVersion deb8u15 blindly; live security index S010 carries deb8u16 and DLA-1900-2 record S013/S014/S021 establishes deb8u16 as corrected revision superseding deficient deb8u15 with lineage and arch preserved.", "evidence_refs": ["S010", "S013", "S014", "S021"], "final_value": "2.4.10-10+deb8u16", "missing_evidence_detected": false, "original_value": "2.4.10-10+deb8u16", "review_class": "NO_EDIT", "unsupported_claim_detected": false}, "validation_command": {"edit_reason": "Pack evidence_sufficiency.validation_command is INSUFFICIENT with PROCEDURE_UNKNOWN L5 missing; gate is authoritative so validation_command must remain null. Agent abstention with VALIDATION_GATE_INSUFFICIENT is correct; no value filled.", "evidence_refs": [], "final_value": null, "missing_evidence_detected": true, "original_value": null, "review_class": "ABSTENTION_ACCEPTED", "unsupported_claim_detected": false}}, "pack_sha256": "768320fa82966535d51c944717c71665d342cf752179a64f9e8b87cf12aff1e6", "proposal_sha256": "aca2e0df77433f036be1e870d809aecf21e4dd9704cb06e52d9c587c35d3f86b", "reviewer_context": "Isolated surrogate reviewer ARM_B_L3_L4; read only evidence_pack.json, agent_proposal.json, kalama_patch_semantics_v1.json, human_review.schema.json; no sibling reads, no retrieval, no execution.", "run_id": "6WUM1", "schema": "kalama.patch-assist-prototype/human-review/v1"}