{
  "schema": "kalama.patch-assist-prototype/human-review/v1",
  "experiment_id": "EXP-BASH-7X9B-01",
  "run_id": "B9X4K",
  "action_id": "patch-001",
  "proposal_sha256": "a3f7ba38d1a6f4de4f8282879c34ab49fd5ec3c336d0bf4a872a3c34136cb631",
  "pack_sha256": "35ee44588ee913590b71e241695e299ebfdece631c8cc23b939511b64479fa5a",
  "reviewer_context": "ROLE B surrogate, isolated to ARM_B_L3 pack+proposal plus production contract audit and ownership rules; no sibling arms, no web, no new retrieval.",
  "field_reviews": {
    "fix_type": {
      "original_value": null,
      "final_value": null,
      "review_class": "ABSTENTION_ACCEPTED",
      "edit_reason": "Contract audit lists FixType{A,B,C} without semantic mapping in the permitted section; pack has no source mapping this jessie backport to a value. Filling would require guessing. Cross-field: strategy also abstained so no inconsistency created.",
      "evidence_refs": [],
      "unsupported_claim_detected": false,
      "missing_evidence_detected": true
    },
    "strategy": {
      "original_value": null,
      "final_value": null,
      "review_class": "ABSTENTION_ACCEPTED",
      "edit_reason": "No explicit strategy label in retrieved sources; compatibility pairings not reproduced in permitted contract section and fix_type unresolved. Choosing among 9 strategies would be inference. Abstention consistent with gates and avoids unsupported logic change.",
      "evidence_refs": [],
      "unsupported_claim_detected": false,
      "missing_evidence_detected": true
    },
    "target_version": {
      "original_value": "4.3-11+deb8u2",
      "final_value": "4.3-11+deb8u2",
      "review_class": "NO_EDIT",
      "edit_reason": "Scanner fixed version corroborated by Debian tracker jessie_fixed via DLA-1726-1 and security archive index plus NVD/OSV records; backport distinction from upstream 4.4-1 preserved.",
      "evidence_refs": ["SEED-01", "S005", "S006", "S007", "S011"],
      "unsupported_claim_detected": false,
      "missing_evidence_detected": false
    },
    "artifact_source": {
      "original_value": "http://archive.debian.org/debian-security/pool/updates/main/b/bash/bash_4.3-11+deb8u2_amd64.deb",
      "final_value": "http://archive.debian.org/debian-security/pool/updates/main/b/bash/bash_4.3-11+deb8u2_amd64.deb",
      "review_class": "NO_EDIT",
      "edit_reason": "Exact retrieved artifact path from S011 stanza; S012 confirms bytes with matching SHA-256 and size. No invented URL or checksum.",
      "evidence_refs": ["S011", "S012"],
      "unsupported_claim_detected": false,
      "missing_evidence_detected": false
    },
    "source_identifier": {
      "original_value": "pool/updates/main/b/bash/bash_4.3-11+deb8u2_amd64.deb",
      "final_value": "pool/updates/main/b/bash/bash_4.3-11+deb8u2_amd64.deb",
      "review_class": "NO_EDIT",
      "edit_reason": "Filename field of S011 fixed-version stanza; consistent with artifact_source URL.",
      "evidence_refs": ["S011"],
      "unsupported_claim_detected": false,
      "missing_evidence_detected": false
    },
    "build_system": {
      "original_value": null,
      "final_value": null,
      "review_class": "NO_EDIT",
      "edit_reason": "NOT_APPLICABLE is semantically correct: deb artifact with production build vocabulary locked to maven; no build applies.",
      "evidence_refs": [],
      "unsupported_claim_detected": false,
      "missing_evidence_detected": false
    },
    "command": {
      "original_value": null,
      "final_value": null,
      "review_class": "ABSTENTION_ACCEPTED",
      "edit_reason": "Gate evidence_sufficiency.command=INSUFFICIENT (L5 PROCEDURE_UNKNOWN). Must remain null; no command supplied in review.",
      "evidence_refs": [],
      "unsupported_claim_detected": false,
      "missing_evidence_detected": true
    },
    "validation_command": {
      "original_value": null,
      "final_value": null,
      "review_class": "ABSTENTION_ACCEPTED",
      "edit_reason": "Gate evidence_sufficiency.validation_command=INSUFFICIENT (L5 missing). Must remain null; no validation text supplied.",
      "evidence_refs": [],
      "unsupported_claim_detected": false,
      "missing_evidence_detected": true
    },
    "notes": {
      "original_value": "Target 4.3-11+deb8u2 preserves Debian jessie backport for CVE-2019-9924 via DLA-1726-1 (not upstream 4.4-1); fixed .deb stanza lists Depends/Pre-Depends closure with checksum match; KEV checked-negative.",
      "final_value": "Target 4.3-11+deb8u2 preserves Debian jessie backport for CVE-2019-9924 via DLA-1726-1 (not upstream 4.4-1); fixed .deb stanza lists Depends/Pre-Depends closure with checksum match; KEV checked-negative.",
      "review_class": "NO_EDIT",
      "edit_reason": "Display-only boundaries factually supported by tracker, index, artifact, and KEV records; scope correct; no command leakage and no out-of-scope fix claim.",
      "evidence_refs": ["SEED-01", "S007", "S008", "S011", "S012"],
      "unsupported_claim_detected": false,
      "missing_evidence_detected": false
    }
  },
  "created_at": "2026-09-18T11:00:00Z"
}
